CMCSA,2018-12-31,USD,24297000000,2897000000,None,-394000000,None,11017000000,11709000000,None,None,11862000000,-50854000000,27140000000,379000000,5320000000,5320000000,None,3352000000,3352000000,None,0,44781000000,None,-5320000000,None,583000000,None,6434000000,83216000000,24930000000,9077000000,11102000000,3071000000,3396000000,51609000000,9598000000,8013000000,17164000000,6901000000,14109000000,33442000000,19407000000,2025000000,8508000000,4148000000,66235000000,28782000000,2498000000,None,18060000000,13063000000,34935000000,None,30379000000,5003000000,25376000000,43424000000,8534000000,7646000000,16981000000,51719000000,63234000000,1760000000,17035987226,21233000000,34300000000,13067000000,13067000000,9152000000,11002000000,None,12267000000,682000000,-919000000,31000000,950000000,73000000,-1674000000,999000000,49000000,8183000000,1749000000,892000000,6734000000,4334000000,9133000000,9182000000,Common Stock,The Coca-Cola Company,"The Coca-Cola Company is an American multinational beverage corporation incorporated under Delaware's General Corporation Law and headquartered in Atlanta, Georgia. The Coca-Cola Company has interests in the manufacturing, retailing, and marketing of nonalcoholic beverage concentrates and syrups.",21344,NYSE,USD,USA,MANUFACTURING,BEVERAGES,"ONE COCA COLA PLAZA, ATLANTA, GA, US",December,2021-12-31,272484286000,12602000000,27.93,2.77,5.32,1.68,0.0286,2.25,8.96,0.253,0.288,0.0767,0.425,38655001000,23298000000,2.25,0.692,0.099,67,27.93,25.32,7.05,11.76,7.78,19.43,0.674,62.9,47.89,60.19,56.52,4335470000,2022-04-01,2022-03-14,34.0500,-0.1498127
CMA,2018-12-31,USD,1616000000,58000000,None,49000000,45000000,3000000,90000000,45000000,None,1235000000,1156000000,-1744000000,34000000,1338000000,1338000000,None,263000000,263000000,0,52000000,1850000000,None,-1286000000,None,-1284000000,None,2101000000,15846000000,8610000000,1161000000,4511000000,None,3257000000,6794000000,1394000000,1790000000,4631000000,1150000000,3481000000,2897000000,80000000,3350000000,909000000,689000000,4422000000,2710000000,215000000,696000000,9000000,9000000,1650000000,None,750000000,9000000,736000000,750000000,369000000,253000000,11424000000,None,11485000000,6000000,577000000,12948000000,16125000000,3177000000,9838000000,2801000000,3007000000,None,3190000000,177000000,-27000000,177000000,27000000,15973000000,-2000000,None,460000000,2799000000,698000000,27000000,2101000000,1918000000,2826000000,3286000000,Common Stock,Cognizant Technology Solutions Corporation,"Cognizant is an American multinational technology company that provides business consulting, information technology and outsourcing services. It is headquartered in Teaneck, New Jersey, United States.",1058290,NASDAQ,USD,USA,TECHNOLOGY,SERVICES-COMPUTER PROGRAMMING SERVICES,"500 FRANK W. BURR BLVD., TEANECK, NJ, US",December,2021-12-31,46180061000,3348000000,21.74,1.493,22.84,0.99,0.0128,4.05,35.12,0.116,0.152,0.101,0.187,18507000000,6914000000,4.05,0.846,0.142,94.78,21.74,19.12,2.495,3.778,2.389,12.97,1.139,92.16,65.59,86.64,77.77,524535000,2022-03-01,2022-02-17,68.6900,-0.2087317
CAG,2018-12-31,USD,954200000,477100000,None,104700000,64300000,257000000,251600000,4700000,62800000,811800000,-576200000,-506900000,249100000,967300000,967300000,None,342300000,342300000,None,0,797000000,None,-952400000,None,-123400000,5500000,2400000000,12161000000,3793000000,726000000,726000000,1250000000,1400000000,8262000000,3881000000,4455000000,4167000000,1637000000,2530000000,46000000,46000000,10000000,417000000,168000000,11964000000,3341000000,1222000000,None,12000000,12000000,10042000000,None,6354000000,0,6354000000,6366000000,2107000000,2034000000,197000000,21196000000,21615000000,1466000000,862912792,9231000000,15544000000,6313000000,6313000000,3694000000,5389000000,277000000,5725000000,50000000,-193000000,50000000,193000000,15544000000,None,None,59000000,3306000000,906000000,193000000,2558000000,2230000000,3694000000,3558000000,Common Stock,Colgate-Palmolive Company,"Colgate-Palmolive Company is an American multinational consumer products company headquartered on Park Avenue in Midtown Manhattan, New York City. It specializes in the production, distribution and provision of household, health care, personal care and veterinary products.",21665,NYSE,USD,USA,LIFE SCIENCES,"PERFUMES, COSMETICS & OTHER TOILET PREPARATIONS","300 PARK AVE, NEW YORK, NY, US",December,2021-12-31,65675653000,4387000000,30.64,4.036,0.725,1.79,0.0238,2.55,20.62,0.124,0.22,0.155,2.257,17421001000,10375000000,2.55,-0.777,0.018,87.31,30.64,23.87,3.77,109.79,4.206,16.43,0.621,85.15,72.5,82.23,80.03,840487000,2022-02-15,2022-01-21,21.3600,-0.4329705
COP,2018-12-31,USD,12934000000,1000000000,None,343000000,-266000000,5956000000,6750000000,-235000000,-86000000,6305000000,-3843000000,-9359000000,None,2999000000,2999000000,None,1363000000,1363000000,None,121000000,None,None,-2878000000,None,-268000000,None,11731000000,251684000000,21848000000,3814000000,3908000000,None,11104000000,275668000000,44437000000,51306000000,217497000000,151343000000,66154000000,7977000000,7883000000,94000000,3184000000,5802000000,180071000000,27603000000,8494000000,2832000000,4398000000,4398000000,123686000000,None,113445000000,4398000000,114100000000,113445000000,12529000000,15329000000,71613000000,7517000000,41983000000,54000000,4539000000,74793000000,94507000000,19714000000,29692000000,19009000000,8454000000,None,19498000000,None,-3542000000,-4093000000,3542000000,None,-225000000,8281000000,11017000000,15111000000,3380000000,3542000000,11862000000,10908000000,18653000000,29670000000,Common Stock,Comcast Corporation,"Comcast Corporation is an American telecommunications conglomerate headquartered in Philadelphia, Pennsylvania. It is the second-largest broadcasting and cable television company in the world by revenue (behind AT&T), the largest pay-TV company, the largest cable TV company and largest home Internet service provider in the United States, and the nation's third-largest home telephone service provider. Comcast provides services to U.S. residential and commercial customers in 40 states and in the District of Columbia. As the parent company of the international media company NBCUniversal since 2011, Comcast is a producer of feature films and television programs intended for theatrical exhibition and over-the-air and cable television broadcast, respectively.",1166691,NASDAQ,USD,USA,TECHNOLOGY,CABLE & OTHER PAY TELEVISION SERVICES,"ONE COMCAST CENTER, PHILADELPHIA, PA, US",December,2021-12-31,213379138000,34621002000,15.48,0.964,21.2,1,0.0239,3.04,25.39,0.122,0.179,0.0473,0.145,116384997000,77935000000,3.04,-0.095,0.095,62.03,15.48,13.11,1.833,2.2,2.557,8.0,0.918,61.22,44.27,49.31,54.34,4523790000,2022-04-27,2022-04-05,62.3500,0.1359082
ED,2018-12-31,USD,2695000000,1284000000,None,480000000,595000000,-117000000,5249000000,175000000,20000000,1382000000,-5471000000,2938000000,1989000000,None,None,None,840000000,842000000,None,705000000,3030000000,None,758000000,None,162000000,None,1235000000,70818000000,4698000000,4561000000,4695000000,1000000,None,1118000000,475000000,944000000,635000000,4000000,635000000,190000000,49492000000,134000000,-4245000000,41558000000,63311000000,44000000,None,None,44000000,44000000,2663000000,None,6463000000,44000000,None,6507000000,60604000000,1243000000,7507000000,3954000000,8781000000,1141000000,162000000,1655000000,3448000000,1793000000,266000000,1161000000,305000000,None,494000000,None,2352000000,2619000000,267000000,976000000,None,None,120000000,1535000000,300000000,267000000,-933000000,1076000000,1802000000,1922000000,Common Stock,Comerica Incorporated,"Comerica Incorporated is a financial services company headquartered in Dallas, Texas.",28412,NYSE,USD,USA,FINANCE,NATIONAL COMMERCIAL BANKS,"1717 MAIN STREET MC6404, ATTN: DARLENE PERSONS, DALLAS, TX, US",December,2021-12-31,12523288000,None,11.44,0.776,57.41,2.72,0.0291,8.35,24.84,0.349,0.451,0.0128,0.146,3351000000,3351000000,8.35,0.115,0.032,105.87,11.44,15.22,3.737,1.675,-,-,1.424,102.09,61.97,93.09,81.37,131079000,2022-01-01,2021-12-14,76.4600,-0.0999411
STZ,2018-05-27,USD,1931400000,322200000,None,-58800000,733700000,299700000,1057600000,34100000,123800000,2330800000,-1423100000,-601200000,137200000,1038500000,1038500000,None,400100000,400100000,None,None,7933400000,None,-989100000,None,-87100000,5800000,808400000,10389500000,1938900000,128000000,128000000,988700000,569400000,8313400000,1589500000,2419000000,5759900000,1282800000,4477100000,9200000,776200000,4800000,184900000,906300000,6632900000,2336200000,905300000,None,307000000,584300000,4585500000,None,3540000000,307000000,3231500000,3540000000,846600000,1060800000,3676200000,4977900000,4744900000,2839700000,393700000,2351500000,7777600000,7176500000,5586800000,1412500000,1398400000,47300000,1637000000,3800000,-158700000,3800000,162500000,-2000000,97300000,222100000,257000000,983000000,174600000,162500000,794100000,928900000,1412500000,1402500000,Common Stock,Conagra Brands Inc,"Conagra Brands, Inc. (formerly ConAgra Foods) is an American consumer packaged goods holding company headquartered in Chicago, Illinois. Conagra makes and sells products under various brand names that are available in supermarkets, restaurants, and food service establishments.",23217,NYSE,USD,USA,MANUFACTURING,FOOD AND KINDRED PRODUCTS,"ONE CONAGRA DR, OMAHA, NE, US",May,2021-11-30,16957323000,2123200000,15.51,2.131,18.09,1.175,0.0364,2.279,23.3,0.0982,0.159,0.0497,0.128,11222800000,3216300000,2.279,-0.26,0.021,36.88,15.51,13.14,1.511,1.991,2.37,13.59,0.791,38.36,30.44,34.66,34.31,479698000,2022-03-02,2022-01-28,223.0800,0.220684
CPRT,2018-12-31,USD,535069000,142161000,None,49584000,53916000,78598000,296697000,49251000,3959000,418007000,-288476000,-182038000,-231000000,0,0,None,235000,235000,None,None,0,None,50312000,None,64420000,-135000,6257000000,69980000000,13274000000,5915000000,6163000000,1007000000,4067000000,56706000000,45698000000,64899000000,None,None,None,9261000000,9005000000,248000000,575000000,1344000000,37916000000,7395000000,3863000000,206000000,112000000,1956000000,21641000000,None,14191000000,112000000,None,16147000000,1259000000,10644000000,31939000000,42905000000,34010000000,18000000,1150977000,23652000000,38727000000,15075000000,14294000000,18038000000,401000000,78000000,4551000000,97000000,-802000000,97000000,802000000,37573000000,173000000,None,5956000000,9925000000,3668000000,735000000,6305000000,5654000000,10727000000,16616000000,Common Stock,ConocoPhillips,"ConocoPhillips is an American multinational corporation engaged in hydrocarbon exploration. It is based in the Energy Corridor district of Houston, Texas.",1163165,NYSE,USD,USA,ENERGY & TRANSPORTATION,PETROLEUM REFINING,"925 N. ELDRIDGE PARKWAY, HOUSTON, TX, US",December,2021-12-31,118608093000,20018999000,15.04,1.154,34.87,1.75,0.0162,6.07,35.24,0.173,0.274,0.104,0.215,46660002000,22936000000,6.07,5.46,1.771,102.9,15.04,10.38,2.542,2.565,2.833,6.16,1.441,94.45,46.48,82.9,68.1,1299530000,2022-04-14,2022-03-30,47.7800,0.1062746
GLW,2018-12-31,USD,2919000000,205000000,700000000,358000000,520000000,1307000000,68000000,154000000,346000000,1090000000,-2887000000,-1995000000,-629000000,2227000000,2227000000,None,685000000,685000000,None,None,1485000000,None,-2146000000,None,-1962000000,1000000,1382000000,53920000000,3864000000,895000000,895000000,358000000,1311000000,56704000000,41749000000,275000000,2094000000,1654000000,440000000,2000000,1766000000,None,122000000,6541000000,37194000000,6207000000,1187000000,20000000,1475000000,825000000,13379000000,None,18145000000,650000000,17495000000,18970000000,363000000,13064000000,16726000000,-1038000000,10728000000,34000000,320960396,8579000000,12337000000,3758000000,6100000000,2664000000,2280000000,24000000,9804000000,119000000,-829000000,-10000000,819000000,11920000000,-210000000,None,1438000000,1783000000,401000000,819000000,1382000000,1392000000,2602000000,4040000000,Common Stock,Consolidated Edison Inc,"Consolidated Edison, Inc., commonly known as Con Edison (stylized as conEdison) or ConEd, is one of the largest investor-owned energy companies in the United States, with approximately $12 billion in annual revenues as of 2017, and over $48 billion in assets. The company provides a wide range of energy-related products and services to its customers through its subsidiaries.",1047862,NYSE,USD,USA,ENERGY & TRANSPORTATION,ELECTRIC & OTHER SERVICES COMBINED,"4 IRVING PLACE, NEW YORK, NY, US",December,2021-12-31,30430495000,4720000000,22.32,5.24,56.6,3.1,0.0374,3.85,39.25,0.0984,0.197,0.0267,0.0606,13676000000,7668000000,3.85,3.991,0.154,78.38,22.32,18.9,2.225,1.495,3.954,12.48,0.207,86.84,63.51,84.12,77.98,354090000,2022-03-15,2022-02-15,30.2100,-0.0556424
COST,2018-02-28,USD,5774000000,1204000000,None,1561000000,1362000000,1437000000,2969000000,None,1313000000,3179000000,-2947000000,-1281000000,80000000,328000000,328000000,None,689000000,None,None,None,0,None,-328000000,None,1509000000,-37000000,2303400000,20538700000,3474000000,90300000,745900000,2084000000,776200000,17064700000,4789700000,1484000000,11387900000,3304800000,8083100000,655600000,0,None,133400000,93400000,12547000000,2039600000,592200000,None,769100000,746800000,10531300000,None,9439900000,22300000,9417600000,10186700000,583400000,136100000,7975100000,3807400000,9157200000,2900000,193593000,3812500000,7909000000,5306400000,3767800000,2279800000,1532700000,None,1538600000,487200000,-334300000,155200000,334300000,-83500000,487200000,293800000,5900000,2326100000,22700000,431300000,2330800000,2500300000,2660400000,2666300000,Common Stock,Constellation Brands Inc,"Constellation Brands, Inc., headquartered in Victor, New York, is an American producer and marketer of beer, wine, and spirits.",16918,NYSE,USD,USA,MANUFACTURING,BEVERAGES,"207 HIGH POINT DRIVE, BUILDING 100, VICTOR, NY, US",February,2021-11-30,41136239000,3252500000,None,2.479,59.93,3.03,0.0141,-0.278,45.24,-0.0061,0.337,0.0688,-0.0011,8671200000,4574300000,-0.278,-0.621,-0.048,272.52,-,17.83,4.744,3.602,5.84,51.59,1.176,257.17,205.83,239.13,227.59,164339000,2022-02-23,2022-02-08,190.9000,0.0774354
CTRA,2018-07-31,USD,898160000,79846000,None,-2552000,23806000,568817000,764558000,25036000,-1334000,100393000,-706153000,-210502000,None,None,123741000,None,78838000,78838000,None,0,0,None,-123741000,None,-18495000,None,417867000,2307698000,709116000,274520000,274520000,16734000,366913000,1598112000,1163425000,490120000,402127000,64892000,337235000,None,None,None,50949000,32560000,726599000,277256000,133717000,4488000,1151000,1151000,449343000,None,400000000,1151000,None,400000000,75457000,3586000,1581099000,None,1162146000,23000,233898841,762366000,1805695000,1043329000,196461000,584345000,182790000,None,1408522000,1293000,-20368000,1293000,20368000,-3240000,-2759000,58800000,14000000,562371000,144504000,20368000,418007000,410615000,582739000,596739000,Common Stock,Copart Inc,"Copart, Inc. or simply Copart is a global provider of online vehicle auction and remarketing services to automotive resellers such as insurance, rental car, fleet and finance companies in 11 countries: the US, Canada, the UK, Germany, Ireland, Brazil, Spain, Dubai, Bahrain, Oman and Finland.",900075,NASDAQ,USD,USA,TRADE & SERVICES,RETAIL-AUTO DEALERS & GASOLINE STATIONS,"14185 DALLAS PARKWAY, SUITE 300, DALLAS, TX, US",July,2022-01-31,29574971000,1424193000,27.53,1.14,17.24,0,0,4.53,13.34,0.345,0.414,0.18,0.31,3160132000,1377451000,4.53,0.469,0.406,166.11,27.53,28.09,9.36,7.09,8.92,19.6,1.114,161.12,101.92,134.66,139.48,237188000,None,None,23.5000,-0.0550864
CCI,2018-12-31,USD,2500000000,0,None,276000000,219000000,1121000000,1739000000,-105000000,None,622000000,-1793000000,-733000000,95000000,34000000,34000000,None,1895000000,1782000000,113000000,None,2742000000,0,807000000,None,-53000000,-1000000,1066000000,27505000000,7034000000,2355000000,2355000000,2037000000,1940000000,19205000000,14895000000,11932000000,3228000000,1292000000,1936000000,524000000,16000000000,None,702000000,1021000000,13619000000,3311000000,1456000000,1976000000,4000000,4000000,13681000000,None,6004000000,4000000,6000000000,5998000000,1851000000,3652000000,13792000000,18870000000,16303000000,857000000,792000000,4461000000,11290000000,6829000000,6829000000,1575000000,1799000000,807000000,2700000000,38000000,-49000000,38000000,49000000,-93000000,-216000000,1199000000,94000000,1503000000,437000000,191000000,1066000000,898000000,1575000000,1646000000,Common Stock,Corning Incorporated,"Corning Incorporated is an American multinational technology company that specializes in specialty glass, ceramics, and related materials and technologies including advanced optics, primarily for industrial and scientific applications.",24741,NYSE,USD,USA,MANUFACTURING,DRAWING & INSULATING OF NONFERROUS WIRE,"ONE RIVERFRONT PLAZA, CORNING, NY, US",December,2021-12-31,34764394000,3774000000,32.11,0.994,14.86,0.96,0.0268,1.28,17.01,0.135,0.163,0.047,0.147,14082000000,5143000000,1.28,1.163,0.097,47.17,32.11,17.64,2.469,2.86,2.908,9.8,0.974,46.0,33.93,38.97,39.51,845849000,2022-03-30,2022-02-25,108.6300,-0.0214395
CSX,2018-12-31,USD,4641000000,1443000000,None,-47000000,-55000000,1331000000,1745000000,46000000,None,3309000000,-1684000000,-2500000000,None,4671000000,4671000000,None,751000000,751000000,None,None,3000000000,None,-4671000000,None,457000000,None,3309000000,108683000000,22972000000,2270000000,2275000000,5310000000,5260000000,29044000000,4544000000,2796000000,22248000000,12055000000,10193000000,None,138000000,5000000,1038000000,1932000000,34023000000,13310000000,3798000000,None,2154000000,1889000000,20220000000,67000000,6038000000,263000000,5775000000,2068000000,4322000000,1795000000,74660000000,None,0,0,750000000,,,,,,,,,,,,,,,,,,,,,,,,Common Stock,Corteva Inc,"Corteva, Inc. (also known as Corteva Agriscience) is a major American agricultural chemical and seed company that was the agricultural unit of DowDuPont prior to being spun off as an independent public company.",1755672,NYSE,USD,USA,LIFE SCIENCES,AGRICULTURAL PRODUCTION-CROPS,"974 CENTRE ROAD, BUILDING 735, WILMINGTON, DE, US",December,2021-12-31,37688766000,3878000000,21.88,2.667,34.94,0.55,0.0108,2.369,21.27,0.112,0.168,0.0388,0.0719,15655000000,6435000000,2.369,2.892,0.085,55.42,21.88,21.14,2.408,1.452,2.135,9.24,0.743,52.38,40.36,48.15,45.27,727021000,2022-03-15,2022-02-28,62.1300,0.129431
CMI,2018-09-02,USD,2378000000,84000000,None,735000000,1220000000,611000000,784000000,363000000,695000000,2187000000,-974000000,-1400000000,1000000,1140000000,1140000000,None,718000000,718000000,None,13000000,0,None,-1140000000,None,-66000000,-70000000,3134000000,40830000000,20289000000,6055000000,7259000000,11040000000,1669000000,20541000000,19681000000,11033000000,None,None,None,None,None,1204000000,321000000,860000000,27727000000,19926000000,11237000000,1624000000,90000000,463000000,7801000000,None,6613000000,90000000,6487000000,6613000000,2924000000,1314000000,12799000000,None,7887000000,4000000,438189000,4480000000,141576000000,137096000000,123152000000,4480000000,13876000000,None,13944000000,None,-159000000,None,159000000,141576000000,None,None,None,4397000000,1263000000,159000000,3179000000,2949000000,4556000000,None,Common Stock,Costco Wholesale Corporation,"Costco Wholesale Corporation (doing business as Costco Wholesale and also known simply as Costco) is an American multinational corporation which operates a chain of membership-only (needing a membership to shop there) big-box retail stores. As of 2020, Costco was the fifth largest retailer in the world, and the world's largest retailer of choice and prime beef, organic foods, rotisserie chicken, and wine as of 2016.",909832,NASDAQ,USD,USA,TRADE & SERVICES,RETAIL-VARIETY STORES,"999 LAKE DRIVE, ISSAQUAH, WA, US",September,2021-09-30,229471617000,9413000000,44.5,4.223,41.64,3.07,0.0063,11.63,458.23,0.0254,0.0374,0.0764,0.306,203084005000,25245000000,11.63,0.137,0.166,557.68,44.5,40.98,1.13,12.31,1.103,25.06,0.684,570.63,304.81,523.76,466.66,443432000,2022-02-18,2022-02-03,146.0700,-0.1306909
CVS,2017-12-31,USD,8865000000,26761000000,187163000000,2183000000,2295000000,2718000000,2037000000,1139000000,1153000000,-596000000,-43285000000,36819000000,-556000000,0,0,None,2038000000,2038000000,None,None,44343000000,None,242000000,None,2399000000,None,100393000,4727344000,764957000,480047000,480047000,8006000,216004000,9100339000,3072204000,2135021000,None,None,None,88316000,86077000,None,2794000,23012000,2203439000,630050000,238045000,None,304000000,304000000,1602534000,None,1521891000,304000000,1217891000,1521891000,236735000,39723000,2523905000,430576000,1162430000,47555000,462358000,1096738000,1764219000,667481000,102310000,-151260000,77187000,None,1803428000,None,-82130000,-77356000,4774000,22287000,4955000,None,568817000,-228435000,-328828000,4774000,100393000,101485000,-151260000,422512000,Common Stock,Coterra Energy Inc,"Coterra Energy Inc., an independent oil and gas company, explores, exploits, develops, produces and markets oil and gas properties in the United States. The company is headquartered in Houston, Texas.",858470,NYSE,USD,USA,ENERGY & TRANSPORTATION,CRUDE PETROLEUM & NATURAL GAS,"840 GESSNER ROAD, SUITE 1400, HOUSTON, TX, US",December,2021-09-30,18476356000,916338000,25.84,0.141,5.82,0.42,0.0192,0.879,4.858,0.181,0.277,0.0733,0.158,1939541000,760715000,0.879,0,0.925,27.52,25.84,5.84,9.53,7.9,11.47,22.28,-0.205,24.39,13.75,21.3,19.16,813578000,2021-11-24,2021-11-12,72.5000,-0.0812318
DHI,2018-12-31,USD,545200000,7624500000,7400000000,129100000,1196300000,62400000,70200000,None,1056600000,1462300000,19000000,-82500000,199500000,127500000,127500000,None,188400000,188400000,None,0,None,None,-80100000,None,465300000,None,559000000,32762000000,1229000000,277000000,277000000,None,501000000,31868000000,13653000000,8563000000,15594000000,5516000000,10078000000,None,None,131000000,148000000,920000000,21191000000,1506000000,313000000,498000000,107000000,107000000,19334000000,None,16682000000,107000000,None,16789000000,351000000,3110000000,11571000000,None,-5732000000,4000000,415000000,4383000000,5370000000,1040000000,434000000,1383000000,563000000,None,603000000,5000000,-621000000,5000000,621000000,5317000000,1000000,1100000000,445000000,540000000,-19000000,727000000,622000000,621000000,1383000000,1606000000,Common Stock,Crown Castle International Corp. (REIT),"Crown Castle is a real estate investment trust and provider of shared communications infrastructure in the United States. Its network includes over 40,000 cell towers and nearly 80,000 route miles of fiber supporting small cells and fiber solutions. Headquartered in Houston, Texas, the company has 100 offices nationwide.",1051470,NYSE,USD,USA,REAL ESTATE & CONSTRUCTION,REAL ESTATE INVESTMENT TRUSTS,"1220 AUGUSTA DRIVE, SUITE 600, HOUSTON, TX, US",December,2021-12-31,72430592000,3613000000,66.32,3.587,19.12,5.46,0.0356,2.527,14.68,0.173,0.319,0.0325,0.131,6340000000,4347000000,2.527,-0.299,0.108,198.83,66.32,41.49,11.42,8.5,15.28,27.84,0.539,209.87,141.87,185.6,187.78,432215000,2022-03-31,2022-03-14,34.6600,-0.3213237
DHR,2018-12-31,USD,4022000000,800100000,None,216900000,307000000,1178000000,655700000,58300000,134000000,2650900000,-2949000000,-797000000,65700000,None,None,None,433000000,433400000,None,0,0,0,229000000,None,157500000,-117700000,3309000000,36729000000,2565000000,858000000,1111000000,263000000,1010000000,32385000000,31998000000,12807000000,None,None,None,None,1779000000,253000000,181000000,387000000,24149000000,1915000000,949000000,None,18000000,18000000,15333000000,None,14739000000,18000000,None,14739000000,179000000,594000000,12580000000,None,12157000000,818000000,830000000,7799000000,11765000000,3966000000,1191000000,4869000000,51000000,None,7381000000,None,-639000000,32000000,639000000,12404000000,4000000,1331000000,1331000000,4304000000,995000000,0,3309000000,3100000000,4869000000,6274000000,Common Stock,CSX Corporation,"CSX Corporation is an American holding company focused on rail transportation and real estate in North America, among other industries. Based in Richmond, Virginia, USA after the merger, in 2003 the CSX Corporation headquarters moved to Jacksonville, Florida.",277948,NASDAQ,USD,USA,ENERGY & TRANSPORTATION,"RAILROADS, LINE-HAUL OPERATING","500 WATER STREET, 15TH FLOOR, JACKSONVILLE, FL, US",December,2021-12-31,75255218000,6643000000,20.42,1.421,6.13,0.373,0.012,1.68,5.57,0.302,0.417,0.0813,0.284,12522000000,6643000000,1.68,0.271,0.213,39.96,20.42,19.27,6.01,5.64,7.23,12.77,1.232,37.9,28.73,35.46,33.73,2193390000,2022-03-15,2022-02-25,103.1200,0.1109675
