IR,2018-12-31,USD,444500000,98500000,None,30700000,-200000,180400000,52200000,-13200000,13000000,269400000,-235000000,-373000000,None,40700000,40700000,None,520900000,520900000,None,0,0,None,-33900000,None,-172100000,-8600000,836000000,6383000000,1745000000,240000000,240000000,128000000,252000000,6578000000,2517000000,1829000000,1755000000,492000000,1263000000,None,None,None,122000000,2121000000,4867000000,1829000000,562000000,331000000,None,None,3038000000,None,1283000000,None,1283000000,1283000000,936000000,189000000,1516000000,1760000000,2609000000,1000000,41900000,7269000000,8176000000,907000000,6385000000,951000000,871000000,25000000,928000000,None,-58000000,-58000000,58000000,None,4000000,167000000,36000000,971000000,135000000,58000000,836000000,661000000,1029000000,1065000000,Common Stock,Huntington Ingalls Industries Inc,Huntington Ingalls Industries (HII) is the largest military shipbuilding company in the United States as well as a provider of professional services to partners in government and industry.,1501585,NYSE,USD,USA,MANUFACTURING,SHIP & BOAT BUILDING & REPAIRING,"4101 WASHINGTON AVENUE, 909-7, 7J2, NEWPORT NEWS, VA, US",December,2021-12-31,7493543000,961000000,13.93,1.101,70.2,4.6,0.0252,13.51,236.33,0.0571,0.0701,0.0445,23.1,9524000000,1368000000,13.5,-0.512,-0.029,216.9,14.22,11.45,0.806,2.65,1.082,10.27,0.98,220.11,173.21,187.74,199.31,39989000,2022-03-11,2022-02-24,20.4500,-0.3972885
INTC,2018-12-31,USD,29432000000,448000000,None,1318000000,1773000000,9085000000,15181000000,1714000000,214000000,21053000000,-11239000000,-18607000000,460000000,10730000000,10730000000,None,5541000000,5541000000,None,None,423000000,None,-10175000000,None,-414000000,None,8728000000,123382000000,49146000000,11379000000,11997000000,1682000000,30563000000,68067000000,10792000000,21668000000,39352000000,3087000000,36265000000,1157000000,192000000,618000000,4904000000,-3019000000,106452000000,38227000000,6558000000,14610000000,10207000000,10207000000,76767000000,None,42656000000,7051000000,35605000000,52863000000,10297000000,12174000000,16796000000,168071000000,159206000000,55151000000,892479411,36936000000,79591000000,42655000000,42655000000,10838000000,19366000000,5379000000,26098000000,None,-723000000,264000000,723000000,None,-1152000000,3127000000,1353000000,11347000000,2619000000,723000000,8723000000,8252000000,12070000000,13423000000,Common Stock,International Business Machines Corporation,"International Business Machines Corporation (IBM) is an American multinational technology company headquartered in Armonk, New York, with operations in over 170 countries. The company began in 1911, founded in Endicott, New York, as the Computing-Tabulating-Recording Company (CTR) and was renamed International Business Machines in 1924. IBM is incorporated in New York. IBM produces and sells computer hardware, middleware and software, and provides hosting and consulting services in areas ranging from mainframe computers to nanotechnology. IBM is also a major research organization, holding the record for most annual U.S. patents generated by a business (as of 2020) for 28 consecutive years. Inventions by IBM include the automated teller machine (ATM), the floppy disk, the hard disk drive, the magnetic stripe card, the relational database, the SQL programming language, the UPC barcode, and dynamic random-access memory (DRAM). The IBM mainframe, exemplified by the System/360, was the dominant computing platform during the 1960s and 1970s.",51143,NYSE,USD,USA,TECHNOLOGY,COMPUTER & OFFICE EQUIPMENT,"1 NEW ORCHARD ROAD, ARMONK, NY, US",December,2021-12-31,111305015000,11999000000,19.56,1.186,21.04,6.56,0.0538,6.35,64.01,0.1,0.0973,0.0242,0.237,57350001000,31486000000,6.35,0.701,-0.18,143.47,19.56,12.18,1.941,5.9,2.78,12.85,1.089,140.73,108.14,131.83,131.87,896320000,2022-03-10,2022-02-10,46.9300,0.0166811
ICE,2018-12-31,USD,2533000000,735000000,None,26000000,89000000,133000000,280000000,44000000,None,2020000000,-1755000000,-463000000,-283000000,1198000000,1198000000,None,555000000,555000000,None,None,None,None,-1198000000,None,315000000,None,410573000,3473857000,1092532000,466407000,466407000,279995000,312192000,2381325000,281220000,434106000,2081282000,383327000,1697955000,7598000,None,None,33938000,18823000,1479217000,364661000,143196000,11082000,483000,483000,1096020000,11616000,851078000,483000,848335000,851561000,212927000,138214000,1994640000,957454000,2342079000,901000,76128000,1117895000,2483666000,1365771000,1365771000,569088000,536724000,48000000,638856000,None,-44134000,-44134000,44134000,2486066000,3985000,None,39049000,528939000,118366000,44134000,410573000,377290000,573073000,612122000,Common Stock,IDEX Corporation,"IDEX Corporation, based in Northbrook, Illinois, is a publicly traded company engaged in the development, design, and manufacture of fluidics systems and specialty engineered products.",832101,NYSE,USD,USA,TECHNOLOGY,PUMPS & PUMPING EQUIPMENT,"3100 SANDERS ROAD, SUITE 301, NORTHBROOK, IL, US",December,2021-12-31,14635305000,760900000,32.74,1.958,36.83,2.16,0.0116,5.88,36.38,0.163,0.238,0.0881,0.168,2764800000,1236100000,5.88,0.18,0.163,240.29,32.74,25.45,5.29,5.14,5.33,20.35,1.082,239.76,181.66,215.53,221.05,76032000,2022-01-28,2022-01-13,75.3300,0.067602
IFF,2018-12-31,USD,390756000,202128000,None,90995000,91628000,117967000,128973000,68851000,18911000,295665000,-299930000,-42558000,-4499000,58069000,58069000,None,206118000,206118000,None,None,498250000,None,-57740000,None,44054000,-4214000,377031000,1620064000,653180000,123794000,123794000,173303000,None,966884000,437270000,None,41825000,41825000,214489000,None,10894000,None,107228000,170218000,1629297000,784220000,None,None,None,398937000,845077000,None,601348000,398937000,None,1000285000,260683000,145523000,-9513000,-2288899000,1167928000,10509000,88470000,1241542000,2213242000,971700000,971700000,491335000,632344000,117863000,750207000,None,-34744000,1151000,34744000,2210142000,1151000,None,83108000,457726000,80695000,34744000,377047000,371710000,492470000,575578000,Common Stock,IDEXX Laboratories Inc,"IDEXX Laboratories, Inc. is an American multinational corporation  engaged in the development, manufacture, and distribution of products and services for the companion animal veterinary, livestock and poultry, water testing, and dairy markets.",874716,NASDAQ,USD,USA,LIFE SCIENCES,IN VITRO & IN VIVO DIAGNOSTIC SUBSTANCES,"ONE IDEXX DRIVE, WESTBROOK, ME, US",December,2021-12-31,44015944000,1036624000,60.75,4.855,8.16,0,0,8.6,37.74,0.232,0.29,0.246,1.126,3215360000,1889432000,8.6,-0.061,0.111,682.43,60.75,54.64,13.69,59.76,13.1,40.62,1.055,706.95,460.36,551.71,612.71,84249000,None,None,134.2700,-0.1201756
IP,2018-11-30,USD,3226000000,0,153000000,151000000,138000000,1328000000,1572000000,342000000,236000000,2017000000,-1569000000,-2046000000,-1000000,732000000,732000000,None,789000000,789000000,None,None,490000000,None,-732000000,None,-429000000,-40000000,542300000,16062300000,1099400000,120000000,120000000,None,813700000,14962900000,579600000,784600000,14320800000,4484800000,9836000000,None,None,None,109200000,47900000,8041800000,2320300000,42200000,None,789900000,789900000,5698200000,None,5713300000,789900000,None,5713300000,579800000,126500000,8020500000,2108800000,2743100000,4700000,397100000,777800000,4009200000,3231400000,1495700000,641300000,1192800000,None,3367900000,3100000,-225700000,3100000,225700000,None,2600000,175100000,541200000,426900000,-115400000,225700000,539200000,334300000,652600000,1193800000,Common Stock,IHS Markit Ltd,IHS Markit Ltd is an American-British information provider based in London. It was formed in 2016 with the merger of IHS Inc. and Markit Ltd.,1598014,NYSE,USD,USA,TECHNOLOGY,"SERVICES-COMPUTER PROGRAMMING, DATA PROCESSING, ETC.","4TH FLOOR, ROPEMAKER PLACE, 25 ROPEMAKER STREET, LONDON, GB",November,2021-11-30,43344081000,1826300000,36.08,2.692,23.78,0.8,0.0074,3.01,11.69,0.259,0.266,0.0469,0.134,4658100000,2949800000,3.01,3.836,0.062,133.71,36.08,30.21,9.31,4.505,10.18,22.07,1.046,135.58,88.19,120.78,118.89,399080000,2022-02-11,2022-01-27,46.1900,-0.1840664
IPG,2018-12-31,USD,565100000,88700000,24300000,449400000,671000000,202900000,177100000,603800000,None,637700000,-2491500000,1853200000,-17500000,117100000,117100000,None,322100000,322100000,None,None,2494200000,None,-101600000,None,-73200000,None,2563000000,14870000000,5778000000,1504000000,1504000000,1318000000,2622000000,8538000000,1791000000,3442000000,5717000000,1084000000,4633000000,51000000,51000000,None,127000000,1030000000,13224000000,3542000000,524000000,215000000,1351000000,1000000,8070000000,None,7379000000,1350000000,6029000000,7380000000,1452000000,839000000,3254000000,17545000000,21217000000,6000000,328100000,5950000000,14768000000,8818000000,8604000000,3584000000,214000000,233000000,445000000,35000000,-257000000,35000000,257000000,14774000000,6000000,272000000,461000000,3394000000,831000000,257000000,2563000000,2218000000,3584000000,4112000000,Common Stock,Illinois Tool Works Inc,"Illinois Tool Works Inc. or ITW is an American company that produces engineered fasteners and components, equipment and consumable systems, and specialty products.",49826,NYSE,USD,USA,TECHNOLOGY,GENERAL INDUSTRIAL MACHINERY & EQUIPMENT,"155 HARLEM AVENUE, GLENVIEW, IL, US",December,2021-12-31,68352643000,3910000000,25.67,1.55,11.59,4.72,0.0229,8.51,45.87,0.186,0.242,0.138,0.791,14455000000,5966000000,8.51,-0.046,0.059,243.76,25.67,23.58,4.729,18.63,5.11,18.76,1.112,249.81,198.92,235.12,229.8,312927000,2022-04-14,2022-03-30,20.6300,0.0233135
INTU,2018-12-31,USD,2112000000,245000000,None,91000000,22000000,253000000,124000000,-4000000,None,1211000000,-532000000,-639000000,0,272000000,272000000,None,407000000,407000000,None,None,0,None,23000000,None,935000000,-11000000,826000000,6959000000,4490000000,1144000000,3512000000,386000000,514000000,2399000000,1075000000,521000000,1016000000,185000000,831000000,2368000000,29000000,2368000000,78000000,308000000,3201000000,1804000000,184000000,381000000,1107000000,1107000000,1368000000,None,890000000,1107000000,890000000,3000000,338000000,359000000,3758000000,2616000000,3083000000,2000000,147000000,2300000000,3333000000,1033000000,35000000,883000000,794000000,623000000,1417000000,44000000,-57000000,44000000,57000000,3333000000,24000000,140000000,39000000,938000000,112000000,57000000,782000000,826000000,995000000,1034000000,Common Stock,Illumina Inc,"Illumina, Inc. is an American company. Incorporated on April 1, 1998, Illumina develops, manufactures, and markets integrated systems for the analysis of genetic variation and biological function. The company provides a line of products and services that serves the sequencing, genotyping and gene expression, and proteomics markets. Its headquarters are located in San Diego, California.",1110803,NASDAQ,USD,USA,LIFE SCIENCES,LABORATORY ANALYTICAL INSTRUMENTS,"5200 ILLUMINA WAY, SAN DIEGO, CA, US",December,2021-12-31,51729928000,903000000,65.38,2.426,68.41,0,0,5.04,30.17,0.168,0.144,0.0357,0.0987,4526000000,3225000000,5.04,-0.597,0.258,416.74,65.38,75.76,11.43,4.54,11.02,41.69,0.91,526,306.66,363.77,416.86,157000000,None,None,196.8500,0.2476233
ISRG,2018-12-31,USD,1169600000,179200000,None,134300000,486100000,121900000,187400000,161300000,279000000,1125000000,-1049600000,126300000,None,0,0,None,None,None,None,None,None,None,473200000,None,246200000,-100000,109493000,2645762000,1832254000,1163980000,1438323000,6967000,None,1028872000,319751000,103231000,586321000,430728000,155593000,274343000,99199000,274343000,79366000,19157000,719795000,425277000,103827000,None,None,18696000,294518000,18696000,19094000000,None,17434000,19094000000,34568000,21927000,1925967000,None,-1877759000,213000,213274660,1787760000,1881883000,94123000,94100000,129223000,434407000,1197957000,1653864000,31760000,-1543000,-45636000,1543000,1881883000,31760000,32300000,21500000,115347000,5854000,1543000,109493000,109091000,116890000,138390000,Common Stock,Incyte Corporation,"Incyte Corp is an American pharmaceutical company based in Alapocas, Delaware.",879169,NASDAQ,USD,USA,TRADE & SERVICES,SERVICES-COMMERCIAL PHYSICAL & BIOLOGICAL RESEARCH,"1801 AUGUSTINE CUT-OFF, WILMINGTON, DE, US",December,2021-12-31,15143055000,659659000,16.02,0.908,17.05,0,0,4.27,13.55,0.318,0.201,0.0882,0.297,2986267000,1340078000,4.27,2.755,0.093,89.6,16.02,17.61,5.07,4.023,4.308,20.41,0.694,88.26,61.91,72.12,73.84,221325000,None,None,478.9200,0.3123253
IVZ,2017-12-31,USD,828800000,100800000,8900000,-997500000,-944400000,142100000,102500000,-944400000,None,883100000,-2898700000,1540000000,330800000,0,51800000,None,490600000,490600000,0,None,None,None,-51800000,None,-573700000,-43800000,18400000,4621200000,1463600000,393300000,393300000,494500000,536300000,3161200000,363200000,203800000,2658800000,1431200000,1227600000,None,None,None,39500000,134600000,3144400000,561800000,269700000,None,20900000,0,2582800000,None,2040200000,20900000,None,2040200000,34200000,226000000,1476800000,23000000,-577800000,2000000,196217971,897900000,2375400000,1477500000,46600000,109100000,446200000,26000000,834000000,None,-140700000,-140700000,140700000,-94600000,3400000,54900000,127200000,-112800000,-131200000,225200000,18500000,161000000,27900000,155100000,Common Stock,Ingersoll Rand Inc,"Ingersoll Rand Inc., founded in 1859, is an American worldwide provider of industrial equipment, technologies and related parts and services to a broad and diverse customer base through a family of brands.",1699150,NYSE,USD,USA,TECHNOLOGY,GENERAL INDUSTRIAL MACHINERY & EQUIPMENT,"800-A BEATY STREET, DAVIDSON, NC, US",December,2021-12-31,20972382000,987800000,38.41,1.103,22.07,0.02,0.0015,1.339,12.42,0.109,0.11,0.0227,0.0573,5152400000,1988500000,1.339,1.02,-0.061,65.64,38.41,22.83,4.07,2.449,4.398,22.16,1.481,62.64,44.99,57.31,53.38,407785000,2021-12-17,2022-03-08,36.5400,0.2043507
IPGP,2018-12-31,USD,393301000,3052000,None,14120000,165892000,80271000,160343000,18814000,135440000,404169000,-562999000,-166647000,0,176065000,176065000,None,None,None,None,None,0,None,-163882000,None,-365542000,-29197000,21053000000,127963000000,28787000000,3019000000,5807000000,7253000000,6884000000,96744000000,48976000000,65342000000,36349000000,11836000000,24513000000,16370000000,5012000000,2788000000,3162000000,4421000000,53400000000,16626000000,3824000000,4758000000,1261000000,500000000,36355000000,None,25859000000,761000000,25098000000,26359000000,7919000000,2646000000,74563000000,None,50172000000,25365000000,4516000000,43737000000,69675000000,33989000000,27111000000,23316000000,6950000000,13543000000,20421000000,438000000,-468000000,438000000,468000000,70143000000,156000000,7520000000,200000000,23317000000,2264000000,728000000,21053000000,21007000000,23785000000,23985000000,Common Stock,Intel Corporation,"Intel Corporation is an American multinational corporation and technology company headquartered in Santa Clara, California, in Silicon Valley. It is the world's largest semiconductor chip manufacturer by revenue, and is the developer of the x86 series of microprocessors, the processors found in most personal computers (PCs).",50863,NASDAQ,USD,USA,MANUFACTURING,SEMICONDUCTORS & RELATED DEVICES,"2200 MISSION COLLEGE BLVD, RNB-4-151, SANTA CLARA, CA, US",December,2021-12-31,194275115000,33874000000,9.82,2.669,23.44,1.39,0.0313,4.86,19.47,0.251,0.279,0.0859,0.225,79023997000,43815000000,4.86,-0.209,0.028,54.4,9.82,13.35,2.458,1.923,2.443,5.66,0.536,66.66,43.63,50.62,52.93,4072000000,2022-03-01,2022-02-04,113.2900,-0.4709289
IQV,2018-12-31,USD,1254000000,480000000,None,390000000,363000000,1141000000,459000000,297000000,None,284000000,-810000000,-452000000,116000000,1405000000,1405000000,None,31000000,31000000,None,None,None,None,-1390000000,None,-68000000,-60000000,1988000000,92791000000,66692000000,724000000,724000000,None,953000000,49976000000,1241000000,1266000000,23547000000,10462000000,13085000000,None,631000000,None,65015000000,24858000000,75489000000,66108000000,None,352000000,1902000000,951000000,9381000000,None,7441000000,951000000,6490000000,7441000000,161000000,350000000,17201000000,2354000000,8317000000,6000000,569000000,3904000000,6030000000,2126000000,2291000000,2583000000,151000000,None,2396000000,None,-244000000,22000000,244000000,6274000000,159000000,133000000,586000000,2488000000,500000000,244000000,1988000000,1896000000,2732000000,3318000000,Common Stock,Intercontinental Exchange Inc,"The Intercontinental Exchange (ICE) is an American Fortune 500 company formed in 2000 that operates global exchanges, clearing houses and provides mortgage technology, data and listing services. The company owns exchanges for financial and commodity markets, and operates regulated exchanges and marketplaces.",1571949,NYSE,USD,USA,FINANCE,"SECURITY & COMMODITY BROKERS, DEALERS, EXCHANGES & SERVICES","5660 NEW NORTHSIDE DRIVE,, THIRD FLOOR, ATLANTA, GA, US",December,2021-12-31,72181129000,4344000000,17.89,2.161,40.48,1.32,0.0123,7.18,12.71,0.568,0.496,0.0139,0.192,7146000000,7146000000,7.18,1.88,0.101,155.38,17.89,22.08,10.1,3.04,9.01,11.58,0.841,139.45,108.16,129.56,123.79,561852000,2022-03-31,2022-03-16,116.1700,0.186619
IRM,2017-12-31,USD,935549000,452933000,None,-2829000,36054000,639514000,2317306000,None,None,355131000,-2221878000,550678000,None,None,None,None,673635000,673635000,None,8716000,None,None,7574000,None,-760214000,-24563000,295665000,4598926000,1896544000,368046000,368046000,649448000,663663000,2673397000,880580000,1210175000,1572075000,415787000,1156288000,0,None,None,215387000,249727000,2914724000,768768000,338188000,None,6966000,5248000,2140864000,None,1639152000,6966000,1632186000,1644400000,369194000,191294000,1684202000,1726234000,3870621000,14470000,78947381,1472463000,3363284000,2531434000,1926256000,552630000,570144000,295469000,829341000,None,-65363000,-75420000,65363000,29928000,49778000,83400000,34694000,537045000,241380000,65363000,295665000,338278000,602408000,637102000,Common Stock,International Flavors & Fragrances Inc.,"International Flavors & Fragrances is an American corporation that produces flavors, fragrances, and cosmetic actives, which it markets globally. It is headquartered in New York City.",51253,NYSE,USD,USA,LIFE SCIENCES,INDUSTRIAL ORGANIC CHEMICALS,"521 W 57TH ST, NEW YORK, NY, US",December,2021-12-31,33954020000,2374000000,117.71,4.692,82.82,3.12,0.0237,-99999.99,47.97,0.0232,0.104,0.0286,-99999.99,11655999000,4108000000,1.1,-0.386,1.386,159.56,123.35,23.31,2.963,1.625,3.86,25.01,1.08,155.28,124.9,139.55,144.27,254547000,2022-01-07,2021-12-27,37.7300,0.1616379
JBHT,2018-12-31,USD,1087841000,123723000,None,179431000,137064000,435893000,995650000,130931000,None,489585000,-886773000,-208080000,66815000,150338000,150338000,None,104994000,104994000,None,None,0,None,-150338000,None,-7012000,None,2012000000,33576000000,6996000000,589000000,589000000,2241000000,3521000000,13469000000,13067000000,20494000000,3767000000,393000000,3374000000,1648000000,1648000000,402000000,250000000,1019000000,26214000000,4694000000,2413000000,56000000,639000000,8022000000,15201000000,None,2639000000,639000000,10015000000,10661000000,1642000000,560000000,7362000000,2332000000,7465000000,449000000,448916000,43714000000,46086000000,2372000000,15555000000,42391000000,1723000000,None,1323000000,198000000,-536000000,198000000,734000000,46622000000,214000000,1200000000,59000000,2457000000,445000000,724000000,1667000000,2145000000,3191000000,3250000000,Common Stock,International Paper Company,"The International Paper Company (NYSE: IP) is an American pulp and paper company, the largest such company in the world. The company is headquartered in Memphis, Tennessee.",51434,NYSE,USD,USA,MANUFACTURING,PAPER MILLS,"6400 POPLAR AVENUE, MEMPHIS, TN, US",December,2021-12-31,17094452000,2810000000,10.17,1.396,23.99,2,0.041,4.466,49.73,0.0905,0.086,0.0366,0.133,19363000000,5531000000,4.466,-0.284,-0.029,51.17,10.17,10.16,0.883,1.993,1.264,9.61,0.908,60.11,42.95,47.13,52.75,376364000,2022-03-15,2022-02-17,93.0400,-0.1908158
JKHY,2018-12-31,USD,412142000,62129000,None,-37991000,89317000,151986000,53273000,-21489000,None,365034000,-291826000,-203641000,None,48986000,48986000,None,105021000,105021000,None,7523000,125000000,None,-41287000,None,-83325000,None,618900000,15620300000,8182900000,673400000,673400000,None,7027200000,8311200000,790900000,1164400000,7065400000,2189500000,4875900000,None,None,None,476600000,428900000,13019600000,8123900000,6698100000,533900000,73800000,73700000,4895700000,None,3605700000,100000,3660200000,3679400000,818100000,812800000,2393200000,0,2400100000,38300000,383600000,-4289500000,9714400000,14003900000,8336200000,1008800000,166500000,None,8705600000,None,-101200000,21800000,123000000,7964100000,-69600000,165300000,202900000,818100000,199200000,123000000,637700000,505600000,941100000,1144000000,Common Stock,The Interpublic Group of Companies Inc,"The Interpublic Group of Companies, Inc. (IPG) is an American publicly traded advertising company. The company consists of five major networks: FCB, IPG Mediabrands, McCann Worldgroup, MullenLowe Group, and Marketing Specialists, as well as a number of independent specialty agencies in the areas of public relations, sports marketing, talent representation, and healthcare.",51644,NYSE,USD,USA,TRADE & SERVICES,SERVICES-ADVERTISING AGENCIES,"909 THIRD AVENUE, NEW YORK, NY, US",December,2021-12-31,14765620000,1725067000,15.68,6.8,8.06,1.08,0.0324,2.39,23.18,0.105,0.159,0.0538,0.307,9107900000,1852900000,2.39,2.227,0.116,41.36,15.68,13.81,1.621,4.483,1.659,10.12,1.032,39.98,25.85,36.63,35.61,393960000,2022-03-15,2022-02-28,126.5200,0.0817373
J,2018-07-31,USD,481152000,302430000,None,141269000,166206000,80731000,94884000,428930000,None,173142000,-1577607000,1142420000,-2679000,2981000,2981000,None,86569000,86569000,None,53584000,5784355000,None,80403000,None,19207000,-26758000,1329000000,5134000000,2422000000,1464000000,1716000000,None,137000000,2687000000,812000000,1382000000,1672000000,61000000,1611000000,452000000,13000000,252000000,551000000,215000000,2318000000,1743000000,178000000,584000000,50000000,50000000,184000000,None,388000000,50000000,None,388000000,198000000,119000000,2816000000,11050000000,8564000000,3000000,258616000,3645000000,6025000000,2319000000,978000000,1560000000,2298000000,1186000000,3487000000,None,-20000000,18000000,20000000,23000000,26000000,228000000,6000000,1566000000,237000000,20000000,1329000000,1315000000,1560000000,1592000000,Common Stock,Intuit Inc,"Intuit Inc. is an American business that specializes in financial software. Intuit's products include the tax preparation application TurboTax, personal finance app Mint and the small business accounting program QuickBooks.",896878,NASDAQ,USD,USA,TECHNOLOGY,SERVICES-PREPACKAGED SOFTWARE,"2700 COAST AVENUE, MOUNTAIN VIEW, CA, US",July,2021-10-31,137953296000,2890000000,64.26,2.33,35.62,2.45,0.0044,7.58,37.86,0.203,0.244,0.128,0.279,10317000000,8000000000,7.58,0.093,0.517,742.37,64.26,41.15,13.37,14.0,13.14,44.53,1.054,716.03,363.32,568.11,550.2,283167000,2022-01-18,2022-01-07,67.6300,0.2828149
SJM,2018-12-31,USD,1218000000,198500000,None,39500000,-103400000,411100000,321900000,-54700000,-54000000,1338600000,-277600000,-922000000,-310000000,7000000,7000000,None,350300000,350300000,None,None,799600000,None,-7000000,None,25800000,7400000,1127900000,7846700000,4333200000,857900000,3063100000,409000000,682300000,2890600000,812000000,436200000,307300000,66700000,240600000,3995900000,1771300000,2205200000,178800000,194300000,1159200000,820600000,100700000,327300000,None,None,338600000,None,None,None,None,None,231800000,338600000,6678800000,None,1521700000,100000,114500000,2604100000,3824400000,2120900000,1120100000,1199400000,986600000,418100000,1404700000,None,80100000,80100000,None,3773000000,80100000,105900000,14200000,1282400000,154500000,None,1125000000,1130100000,1199400000,1213600000,Common Stock,Intuitive Surgical Inc,"Intuitive Surgical, Inc. is an American corporation that develops, manufactures, and markets robotic products designed to improve clinical outcomes of patients through minimally invasive surgery, most notably with the da Vinci Surgical System.",1035267,NASDAQ,USD,USA,LIFE SCIENCES,"ORTHOPEDIC, PROSTHETIC & SURGICAL APPLIANCES & SUPPLIES","1020 KIFER ROAD, SUNNYVALE, CA, US",December,2021-12-31,105001443000,2128400000,62.98,16.65,33.27,0,0,4.66,16.04,0.298,0.319,0.0921,0.159,5710100000,3958500000,4.66,0.024,0.167,335.9,62.98,53.76,18.39,8.44,16.85,45.15,1.189,369.69,227.47,310.01,322.2,357744000,None,None,93.4900,-0.2475048
JNJ,2018-12-31,USD,22201000000,5619000000,None,2107000000,2104000000,6929000000,3670000000,1185000000,644000000,15297000000,-3167000000,-18510000000,-2399000000,5868000000,5868000000,None,9494000000,9494000000,None,None,5000000,None,-5868000000,None,283000000,-241000000,882800000,30978400000,1430900000,1147700000,1430900000,None,None,10098200000,468700000,804800000,9333200000,2176100000,7157100000,613500000,296300000,283200000,11511900000,126100000,21646000000,581400000,None,61300000,284300000,284300000,326400000,None,2408800000,None,2408800000,2693100000,12972000000,11384800000,8578800000,3003600000,5884500000,98100000,397100000,3318000000,5314100000,1996100000,1494400000,1204900000,359600000,None,4109200000,21300000,-111500000,21300000,111500000,5311100000,-40000000,112400000,142100000,1137800000,255000000,111500000,883100000,542200000,1249300000,1391400000,Common Stock,Invesco Ltd,"Invesco Ltd. is an American independent investment management company that is headquartered in Atlanta, Georgia.",914208,NYSE,USD,USA,FINANCE,INVESTMENT ADVICE,"1555 PEACHTREE STREET NE, SUITE 1800, ATLANTA, GA, US",December,2021-12-31,10039765000,1927600000,7.29,0.777,24.9,0.68,0.0324,2.99,14.9,0.236,0.25,0.0311,0.124,6894500000,2307900000,2.99,1.02,0.082,30.73,7.29,7.59,1.456,0.669,2.558,6.64,1.196,29.0,20.02,22.96,24.88,460751000,2022-03-02,2022-02-15,129.0500,-0.076367
